[
  {
    "id": "suoer-saa-1000c-inverter-charger",
    "slug": "suoer-saa-1000c-inverter-charger",
    "category": "Inverter",
    "subCategory": "Inverter with Charger",
    "brand": "Suoer",
    "productName": "100% Orignol Suoer 12 Volt Dc To 220 Volt Ac 1000 Watt DC AC AC Power Inverter With 10A Charger (SAA-1000C)",
    "shortDescription": "1000W modified sine wave inverter that steps 12V DC battery power up to 220V AC and adds a built-in 10A charger for lead-acid batteries.",
    "fullDescription": "The SAA-1000C is a 1000W power inverter for home use, converting 12V DC from a battery into 220V AC for resistive household loads. A built-in 10A charger recharges the connected battery from mains, while the inverter and charger circuits work independently without interference. A 5V 2A USB port lets you charge phones and small devices directly, and reverse-connection protection guards against wiring mistakes.",
    "specifications": [
      {
        "label": "Output Power",
        "value": "1000W"
      },
      {
        "label": "Input Voltage",
        "value": "12V DC"
      },
      {
        "label": "Output Voltage",
        "value": "220V AC"
      },
      {
        "label": "Built-in Charger",
        "value": "10A"
      },
      {
        "label": "USB Output",
        "value": "5V 2A"
      }
    ],
    "features": [
      "Built-in 10A battery charger",
      "Modified sine wave output",
      "Inverter and charger operate independently",
      "Reverse connection protection",
      "5V 2A USB charging interface"
    ],
    "voltage": "12V DC to 220V AC",
    "chargingCurrent": "10A",
    "batteryCompatibility": "Lead Acid",
    "stockStatus": "in_stock",
    "price": 9999,
    "oldPrice": 15000,
    "discount": 33,
    "rating": 0,
    "reviews": 0,
    "image": "https://cdn.shopify.com/s/files/1/0651/6903/1305/files/SAA-1000C.webp?v=1728918167",
    "galleryImages": [
      "https://cdn.shopify.com/s/files/1/0651/6903/1305/files/SAA-1000C.webp?v=1728918167",
      "https://cdn.shopify.com/s/files/1/0651/6903/1305/files/SAA-1000C.webp?v=1728918167"
    ],
    "tags": [
      "inverter",
      "suoer",
      "1000w inverter",
      "inverter with charger",
      "battery charger",
      "home power backup"
    ],
    "relatedProducts": [
      "suoer-sua-2000c-inverter-charger",
      "suoer-son-20a-car-battery-charger",
      "ezee20a-pulse-repair-charger"
    ]
  },
  {
    "id": "suoer-sua-2000c-inverter-charger",
    "slug": "suoer-sua-2000c-inverter-charger",
    "category": "Inverter",
    "subCategory": "Inverter with Charger",
    "brand": "Suoer",
    "productName": "100% Orignol Suoer 12 Volt Dc To 220 Volt Ac 2000 Watt DC AC AC Power Inverter With 20A Charger (SUA-2000C)",
    "shortDescription": "2000W modified sine wave inverter converting 12V/24V battery power to 110V/220V/230V AC with a built-in 20A charger.",
    "fullDescription": "The SUA-2000C is a 2000W power inverter built for home use, converting DC 12V/24V portable power to AC 110V/220V/230V. It includes a built-in 20A charger and a 5V 1A USB interface for mobile devices. Smart soft-start and high conversion efficiency keep operation reliable, while an MCU controls the cooling fan and working status to save power and extend service life. Multiple safety protections guard the unit during daily use.",
    "specifications": [
      {
        "label": "Output Power",
        "value": "2000W"
      },
      {
        "label": "Input Voltage",
        "value": "12V DC / 24V DC"
      },
      {
        "label": "Output Voltage",
        "value": "110V / 220V / 230V AC"
      },
      {
        "label": "Built-in Charger",
        "value": "20A"
      },
      {
        "label": "USB Output",
        "value": "5V 1A"
      }
    ],
    "features": [
      "Built-in max 20A charger",
      "Modified sine waveform output",
      "Smart soft start and high conversion efficiency",
      "Multiple safety protections",
      "MCU-controlled cooling fan for longer service life"
    ],
    "voltage": "12V / 24V DC to 110V / 220V / 230V AC",
    "chargingCurrent": "20A",
    "batteryCompatibility": "Lead Acid",
    "stockStatus": "sold_out",
    "price": 14999,
    "oldPrice": 25000,
    "discount": 40,
    "rating": 0,
    "reviews": 0,
    "image": "https://cdn.shopify.com/s/files/1/0651/6903/1305/files/suoer_E3_80_90-modified-sine-wave-inverter-_E3_80_91-12_main-3.jpg?v=1728917044",
    "galleryImages": [
      "https://cdn.shopify.com/s/files/1/0651/6903/1305/files/suoer_E3_80_90-modified-sine-wave-inverter-_E3_80_91-12_main-3.jpg?v=1728917044",
      "https://cdn.shopify.com/s/files/1/0651/6903/1305/files/suoer_E3_80_90-modified-sine-wave-inverter-_E3_80_91-12_main-3.jpg?v=1728917044"
    ],
    "tags": [
      "inverter",
      "suoer",
      "2000w inverter",
      "inverter with charger",
      "battery charger",
      "solar"
    ],
    "relatedProducts": [
      "suoer-saa-1000c-inverter-charger",
      "suoer-son-20a-car-battery-charger",
      "ezee20a-pulse-repair-charger"
    ]
  },
  {
    "id": "suoer-son-20a-car-battery-charger",
    "slug": "suoer-son-20a-car-battery-charger",
    "category": "Battery Charger",
    "subCategory": "Automatic",
    "brand": "Suoer",
    "productName": "100% Orignol Suoer 12v 24v 20A Automatic Portable Car Battery Charger",
    "shortDescription": "Automatic portable car battery charger for 12V/24V batteries delivering up to 10A/20A with PWM charging.",
    "fullDescription": "The SON-20A+ is an automatic portable charger for 12V or 24V car and household batteries. It uses PWM charging and automatically stops charging once the battery is full, with an LED screen control panel for live status. A manual switch selects between 12V and 24V systems, and it suits gel, AGM, and lead-acid batteries on a 220V mains input.",
    "specifications": [
      {
        "label": "Input Voltage",
        "value": "220V AC"
      },
      {
        "label": "Charging Voltage",
        "value": "12V / 24V"
      },
      {
        "label": "Max Charging Current",
        "value": "10A / 20A"
      },
      {
        "label": "Battery Types",
        "value": "Lead Acid / AGM / Gel"
      }
    ],
    "features": [
      "PWM charging with automatic stop at full charge",
      "LED screen display control panel",
      "Manual 12V/24V selection switch",
      "Portable design for car and home use"
    ],
    "voltage": "12V / 24V",
    "chargingCurrent": "10A / 20A",
    "batteryCompatibility": "Lead Acid / AGM / Gel",
    "stockStatus": "in_stock",
    "price": 6999,
    "oldPrice": 8000,
    "discount": 13,
    "rating": 0,
    "reviews": 0,
    "image": "https://cdn.shopify.com/s/files/1/0651/6903/1305/files/1-1FH5160P1c2.jpg?v=1728918219",
    "galleryImages": [
      "https://cdn.shopify.com/s/files/1/0651/6903/1305/files/1-1FH5160P1c2.jpg?v=1728918219",
      "https://cdn.shopify.com/s/files/1/0651/6903/1305/files/1-1FH5160P1c2.jpg?v=1728918219"
    ],
    "tags": [
      "battery charger",
      "suoer",
      "car battery charger",
      "automatic charger",
      "12v 24v",
      "20a"
    ],
    "relatedProducts": [
      "suoer-son-10a-battery-charger",
      "ezee-smart-charger-12v-10a",
      "ezee20a-pulse-repair-charger"
    ]
  },
  {
    "id": "12v-100a-server-power-supply",
    "slug": "12v-100a-server-power-supply",
    "category": "Server Power Supply",
    "productName": "12V 100A Server Power Supply (Not Battery Charger)",
    "shortDescription": "100A 12V server power supply for high-current 12V loads and bulk battery charging projects (not a dedicated battery charger).",
    "fullDescription": "This is a high-current 12V 100A server power supply unit suited for 12V DC loads and larger battery charging projects. It is explicitly not a battery charger, so no automatic cut-off or charging logic is built in. Each unit is quality checked and tested before shipping.",
    "specifications": [
      {
        "label": "Output Voltage",
        "value": "12V DC"
      },
      {
        "label": "Output Current",
        "value": "100A"
      },
      {
        "label": "Type",
        "value": "Server Power Supply (not a battery charger)"
      }
    ],
    "features": [
      "High continuous 100A output",
      "Tested working before shipping",
      "Ideal for 12V DC loads and charging projects"
    ],
    "voltage": "12V DC",
    "chargingCurrent": "100A",
    "stockStatus": "sold_out",
    "price": 2999,
    "oldPrice": 5000,
    "discount": 40,
    "rating": 0,
    "reviews": 0,
    "image": "https://cdn.shopify.com/s/files/1/0651/6903/1305/files/Server-Power-Supply-DPS-1200FBA-438202-002-440785-001-for-DL580G5-HSTNS-PD11-1200W.jpg?v=1728917936",
    "galleryImages": [
      "https://cdn.shopify.com/s/files/1/0651/6903/1305/files/Server-Power-Supply-DPS-1200FBA-438202-002-440785-001-for-DL580G5-HSTNS-PD11-1200W.jpg?v=1728917936",
      "https://cdn.shopify.com/s/files/1/0651/6903/1305/files/Server-Power-Supply-DPS-1200FBA-438202-002-440785-001-for-DL580G5-HSTNS-PD11-1200W.jpg?v=1728917936"
    ],
    "tags": [
      "server power supply",
      "12v",
      "100a",
      "power supply",
      "battery charging"
    ],
    "relatedProducts": [
      "14v-57a-server-battery-charger",
      "hp-atsn-14v-82a-server-charger",
      "professional-12v-smps-10a-20a-30a"
    ]
  },
  {
    "id": "ezee20a-pulse-repair-charger",
    "slug": "ezee20a-pulse-repair-charger",
    "category": "Battery Charger",
    "subCategory": "Pulse Repair",
    "brand": "EZEE",
    "productName": "12V 24V 20A Automatic Pulse Repair Charger For All Batterys - EZEE20A",
    "shortDescription": "20A automatic pulse repair charger for 12V/24V batteries that revives weak cells and restores charge efficiency.",